{
  "apiProfiles" : [
    {
      "baseURL" : "https://example.com/v1",
      "format" : "openAI",
      "id" : "6DE9E502-6647-4E9A-9FD6-0DE4C3A9631B",
      "model" : "example",
      "name" : "示例接口"
    }
  ],
  "app" : {
    "build" : "1",
    "name" : "拾刻",
    "version" : "1.0"
  },
  "countdownCategories" : [
    {
      "id" : "00000000-0000-4000-8000-000000000001",
      "name" : "纪念日"
    },
    {
      "id" : "00000000-0000-4000-8000-000000000002",
      "name" : "工作"
    },
    {
      "id" : "00000000-0000-4000-8000-000000000003",
      "name" : "生活"
    }
  ],
  "countdowns" : [
    {
      "anchorDate" : "2023-03-22",
      "calendar" : "chinese",
      "categoryID" : "00000000-0000-4000-8000-000000000001",
      "id" : "939C7F2F-952A-4F02-8F5E-684475394A80",
      "includesStartDay" : true,
      "lunarDate" : {
        "day" : 1,
        "isLeapMonth" : true,
        "month" : 2
      },
      "notes" : "",
      "pinned" : false,
      "recurrence" : {
        "frequency" : "yearly",
        "missingDatePolicy" : "clampToLastDay",
        "missingLeapMonthPolicy" : "ordinaryMonth"
      },
      "reminder" : {
        "daysBefore" : [

        ],
        "hour" : 9,
        "milestoneDays" : [
          520,
          1314
        ],
        "minute" : 0
      },
      "targetTime" : {
        "hour" : 13,
        "minute" : 14,
        "second" : 52
      },
      "timeZoneIdentifier" : "Asia/Shanghai",
      "title" : "纪念日"
    }
  ],
  "exportedAt" : "2026-10-13T16:00:00Z",
  "format" : "shike-export",
  "importSessions" : [
    {
      "createdAt" : "2026-10-14T07:01:42Z",
      "drafts" : [
        {
          "calendar" : {
            "account" : "iCloud",
            "title" : "个人"
          },
          "id" : "E3D4DA37-9499-4C0A-858D-FBD714370307",
          "isAllDay" : false,
          "location" : "",
          "needsReview" : false,
          "notes" : "手动修改的备注",
          "reviewNotes" : [

          ],
          "saveInterrupted" : false,
          "saved" : true,
          "selected" : true,
          "sourceExcerpt" : "",
          "timeZoneIdentifier" : "Asia/Shanghai",
          "title" : "阅读"
        }
      ],
      "hasParsed" : false,
      "id" : "EDC9D3C0-28B8-439C-AC56-DB1AB98DBD97",
      "planning" : {
        "awaitingReply" : false,
        "checkedAvailability" : false,
        "end" : "2026-10-20T16:00:00Z",
        "goal" : "一起看书",
        "hasProposal" : false,
        "proposalNeedsUpdate" : false,
        "start" : "2026-10-13T16:00:00Z",
        "turns" : [
          {
            "id" : "A4151EBF-3003-4AB5-9D9D-EE6626768B04",
            "options" : [
              "可以"
            ],
            "role" : "user",
            "text" : "明晚\n九点"
          }
        ]
      },
      "referenceTimeZone" : "Asia/Shanghai",
      "source" : "文字",
      "text" : "中文原文\n第二行 🐱"
    }
  ],
  "preferences" : {
    "activeProfileID" : "6DE9E502-6647-4E9A-9FD6-0DE4C3A9631B",
    "calendar" : {
      "countdownLayout" : "single",
      "showCountdowns" : true,
      "visibleDays" : 1
    },
    "categoryCalendars" : {

    },
    "categoryRoutingEnabled" : true,
    "iCloudEnabled" : false
  },
  "prompts" : {
    "extraction" : {
      "isCustom" : true,
      "text" : "自定义\n规则"
    },
    "planning" : {
      "isCustom" : false,
      "text" : "你是拾刻的日程安排助手。根据用户想做的事，通过逐题问答制定可执行的安排，语气简洁自然。\n信息不足时，每次只问一个关键问题，给 2-4 个简短快捷选项，也允许自由回答。\n依次确认必要的耗时、频次或截止时间、方便时段；已说明的不要重问。日期范围由应用提供。\n用户明确让你决定时直接给一版，说明采用的假设，默认只在当地 09:00-21:00 安排，不编造地点。\n信息足够时生成完整方案；收到修改要求时以 currentProposal 为基础，保留用户已经手动修改的内容。\n只在 rangeStart 至 rangeEndExclusive 内安排，开始不早于 now。有 availableIntervals 时，每个事件完整落在可用区间内，空数组表示没有空闲时间；方案内事件不得重叠。\n没有空闲或无法满足要求时，说明原因，并提出一个问题邀请用户调整时长或日期范围，不硬塞入冲突时间。\n长期目标拆成此范围内的具体事件，不生成重复规则。最多 100 个事件，优先安排关键任务。\n默认使用应用提供的时区，不根据语言或地点更改。按活动本身分类，日历候选不明确时留空。\n自行采用的假设在方案说明和相关事件 reviewNotes 中说明，并设置 needsReview=true。"
    }
  },
  "schemaVersion" : 1
}